{
  "$schema": "https://json-schema.org/draft/2020-12/schema",
  "$id": "https://contabilidade-brasil.local/schemas/close-run.schema.json",
  "title": "Close run",
  "type": "object",
  "additionalProperties": false,
  "required": ["schema_version", "close_run_id", "tenant_id", "legal_entity_id", "period_id", "status", "checklist"],
  "properties": {
    "schema_version": { "type": "string", "pattern": "^[0-9]+\\.[0-9]+\\.[0-9]+$" },
    "close_run_id": { "type": "string", "minLength": 8, "maxLength": 160 },
    "tenant_id": { "type": "string", "maxLength": 160 },
    "legal_entity_id": { "type": "string", "maxLength": 160 },
    "period_id": { "type": "string", "maxLength": 80 },
    "status": { "type": "string", "enum": ["open", "closing", "closed", "reopened", "cancelled"] },
    "checklist": {
      "type": "array",
      "minItems": 1,
      "maxItems": 200,
      "items": {
        "type": "object",
        "additionalProperties": false,
        "required": ["item_id", "category", "status", "title"],
        "properties": {
          "item_id": { "type": "string", "maxLength": 160 },
          "category": { "type": "string", "enum": ["master_data", "subledger", "bank", "tax", "documents", "reports", "obligation", "approval"] },
          "status": { "type": "string", "enum": ["pending", "in_progress", "blocked", "completed", "not_applicable"] },
          "title": { "type": "string", "maxLength": 500 },
          "owner_id": { "type": ["string", "null"], "maxLength": 160 },
          "evidence_ref": { "type": ["string", "null"], "maxLength": 200 },
          "blocking": { "type": "boolean" }
        }
      }
    },
    "snapshot_ref": { "type": ["string", "null"], "maxLength": 200 },
    "evidence_package_ref": { "type": ["string", "null"], "maxLength": 200 },
    "reopened_reason": { "type": ["string", "null"], "maxLength": 2000 },
    "approved_by": { "type": ["string", "null"], "maxLength": 160 },
    "audit_event_id": { "type": ["string", "null"], "maxLength": 160 }
  }
}
